Assessment Name,URL,Category,Remote Testing,Adaptive/IRT,Test Type,Description,Job Level,Assessment Length
Executive - Short Form,https://www.shl.com/solutions/products/product-catalog/view/executive-short-form/,Pre-packaged Job Solutions,No,Yes,"A, B, P","The Executive solution is intended for use with senior executive level positions responsible for planning, directing, or coordinating key business activities and operations at the highest level of an organization. Executives at this level often accomplish their work through subordinate executives and provide overall direction to their organization by determining and formulating policies within guidelines set up by a board of directors or similar governing body. Potential job titles that use this solution are: Executive Vice President, President, and Executive Director.","Executive,",Approximate Completion Time in minutes = 74
Financial Professional - Short Form,https://www.shl.com/solutions/products/product-catalog/view/financial-professional-short-form/,Pre-packaged Job Solutions,No,No,"A, B, P","This solution is for mid-level financial institution positions that require Series 6/7 certification. Candidates answer multiple choice questions to measure financial professional aptitude, learning potential, achievement orientation, conscientiousness, persistence and planfulness, self leadership, interpersonal leadership, sales focus and customer focus.","Mid-Professional, Professional Individual Contributor,",Approximate Completion Time in minutes = 35
Account Manager Solution,https://www.shl.com/solutions/products/product-catalog/view/account-manager-solution/,Pre-packaged Job Solutions,No,Yes,"C, P, A, B","The Account Manager solution is an assessment used for job candidates applying to mid-level leadership positions that tend to manage the day-to-day operations and activities of client accounts. Sample tasks for these jobs include, but are not limited to: communicating with clients about project status, developing and maintaining project plans, coordinating internally with appropriate project personnel, and ensuring client expectations are being met. Potential job titles that use this solution are: Account Executive, Account Manager, and Senior Account Manager. There are multiple configurations of this solution available.","Mid-Professional,",Approximate Completion Time in minutes = 49
Administrative Professional - Short Form,https://www.shl.com/solutions/products/product-catalog/view/administrative-professional-short-form/,Pre-packaged Job Solutions,No,Yes,"A, K, P","The Administrative Professional solution is for entry to mid-level positions that involve routine clerical and administrative functions in addition to office management functions and customer service. Sample tasks for this job include, but are not limited to: arranging conference calls; drafting correspondence; scheduling meetings; greeting visitors; coordinating office activities. Potential job titles that use this solution are: Administrative Assistant, Secretary, Office Manager, Administrative Aide, and Administrative Associate.","Entry-Level,",Approximate Completion Time in minutes = 36
Agency Manager Solution,https://www.shl.com/solutions/products/product-catalog/view/agency-manager-solution/,Pre-packaged Job Solutions,No,Yes,"A, B, P, S","The Agency Manager solution is for mid-level sales management positions that include front line management and sales responsibilities. Sample tasks for this job include, but are not limited to: directing and coordinating financial activities of workers in a branch, office, or department of an establishment, such as branch bank, brokerage firm, risk and insurance department, or credit department.  Potential job titles that use this solution are: Agency Manager, Brokerage Manager. Multiple configurations of this solution are available.","Front Line Manager, Manager, Supervisor,",Approximate Completion Time in minutes = 51
Apprentice + 8.0 Job Focused Assessment,https://www.shl.com/solutions/products/product-catalog/view/apprentice-8-0-job-focused-assessment-4261/,Pre-packaged Job Solutions,No,No,"B, P","The Apprentice + 8.0 Job-Focused Assessment is a short, targeted, globally applicable assessment which includes a short cognitive ability measure. This assessment is designed for entry-level positions appropriate for countries and industries that use an apprenticeship model. It is intended to be used multi-nationally for organisations whose business spans across regions.","General Population, Graduate, Entry-Level,",Approximate Completion Time in minutes = 30
Apprentice 8.0 Job Focused Assessment,https://www.shl.com/solutions/products/product-catalog/view/apprentice-8-0-job-focused-assessment/,Pre-packaged Job Solutions,No,No,"B, P","The Apprentice 8.0 Job-Focused Assessment is a short, targeted, globally applicable assessment. This assessment is designed for entry-level positions appropriate for countries and industries that use an apprenticeship model. It is intended to be used multi-nationally for organizations whose business spans across regions.","Entry-Level, General Population, Graduate,",Approximate Completion Time in minutes = 20
Bank Administrative Assistant - Short Form,https://www.shl.com/solutions/products/product-catalog/view/bank-administrative-assistant-short-form/,Pre-packaged Job Solutions,No,No,"A, B, K, P","The Administrative Assistant solution is for entry-level clerical positions that interact with external or internal customers. Sample tasks for these jobs include, but are not limited to: answering telephones, managing files and records, sorting mail, greeting customers, and collaborating with co-workers on projects. Potential job titles that use this solution are: Receptionist and Administrative Assistant. There are multiple configurations of this solution available.","Entry-Level,",Approximate Completion Time in minutes = 35
Bank Collections Agent - Short Form,https://www.shl.com/solutions/products/product-catalog/view/bank-collections-agent-short-form/,Pre-packaged Job Solutions,No,No,"A, B, P","This solution is for entry-level collections positions in an inbound or outbound call center environment in a financial setting. Candidates answer multiple choice questions to measure achievement orientation, dependability, collector numerical skills, revenue recovery, customer focus, and persistence and planfulness. There are multiple configurations and versions of this solution available.","Entry-Level,",Approximate Completion Time in minutes = 45
Bank Operations Supervisor - Short Form,https://www.shl.com/solutions/products/product-catalog/view/bank-operations-supervisor-short-form/,Pre-packaged Job Solutions,No,Yes,"A, B, P, S","The Bank Operations Supervisor solution is for job candidates applying to entry-level leadership positions who tend to supervise hourly employees. Sample tasks for these jobs include, but are not limited to:  planning and preparing work schedules, assigning employees to specific duties; coaching  employees on attendance, conduct, schedule adherence, and work tasks, developing employees' skills ; training subordinates; prioritizing multiple tasks  and priorities; and making  day-to-day decisions with minimal guidance from others. Potential job titles that use this solution are: Team Leader, First Line Supervisor, Processing Supervisor, Call Center Supervisor, and Customer Service Supervisor. There are multiple configurations and versions of this solution available.","Front Line Manager, Manager, Supervisor,",Approximate Completion Time in minutes = 45
Bilingual Spanish Reservation Agent Solution,https://www.shl.com/solutions/products/product-catalog/view/bilingual-spanish-reservation-agent-solution/,Pre-packaged Job Solutions,No,Yes,"B, P, S, A","The Bilingual Reservation Agent solution is designed for customer centered entry-level positions within the hospitality industry. Sample tasks may include making, updating, or canceling hotel reservations made in English or Spanish; listening to customers speak Spanish and entering information into a computer in English; providing information on the hotel and the services offered. Potential job titles that use this solution are: Bilingual Reservation Agent, Customer Service Representative and Reservationist. Multiple configurations of this solution are available.","Entry-Level,",Approximate Completion Time in minutes = 43
"Bookkeeping, Accounting, Auditing Clerk Short Form",https://www.shl.com/solutions/products/product-catalog/view/bookkeeping-accounting-auditing-clerk-short-form/,Pre-packaged Job Solutions,No,Yes,"P, S, K, B, A","The Bookkeeping, Accounting, and Auditing Clerk solution is for entry-level positions that involve entering numerical data into computer systems and maintaining financial records. Sample tasks for this job include, but are not limited to: entering financial data into computers; checking financial records for accuracy; perform routine computations on financial data. Potential job titles that use this solution are: Accounting Clerk, Bookkeeper, Accounting Associate, Auditing Clerk and Accounts Receivable Clerk.","Entry-Level,",Approximate Completion Time in minutes = 49
Branch Manager - Short Form,https://www.shl.com/solutions/products/product-catalog/view/branch-manager-short-form/,Pre-packaged Job Solutions,No,No,"A, B, P","This solution is for mid to upper-level financial institution managerial positions. Candidates answer a series of multiple choice questions to measure management potential, management judgment, leadership potential, team management, branch manager problem solving, business leadership, leadership motivation, interpersonal leadership, self leadership, and branch manager judgment. There are multiple configurations and versions of this solution available.","Front Line Manager, Manager, Supervisor,",Approximate Completion Time in minutes = 50
Cashier Solution,https://www.shl.com/solutions/products/product-catalog/view/cashier-solution/,Pre-packaged Job Solutions,No,Yes,"B, A, P","The Cashier solution is for entry-level retail positions in which employees receive payment in the form of cash, check, or credit cards for goods purchased. Sample tasks for these jobs include, but are not limited to: handling payments, offering customer service, and issuing receipts and refunds. Potential job titles that use this solution are: Cashier, Sales Associate, and Clerk. There are multiple configurations and versions of this solution available.","Entry-Level,",Approximate Completion Time in minutes = 28
Guest Services Associate Solution,https://www.shl.com/solutions/products/product-catalog/view/guest-services-associate-solution/,Pre-packaged Job Solutions,No,Yes,"A, B, P, S","The Guest Services Associate solution is designed for entry to mid-level customer service positions in the hospitality industry. The solution is for highly customer service focused positions with few to no sales components. Sample tasks may include: providing information on entertainment, dining and transportation to guests, making dining recommentations to guests, arranging transportation for guests, and making reservations. Potential job titles that use this solution are: Concierge, Guest Services Agent, Club Concierge, Hotel Concierge, Front Office Manager and Guest Services Associate. Multiple configurations of this solution are available.","Entry-Level,",Approximate Completion Time in minutes = 48
Healthcare Aide 7.0 Solution,https://www.shl.com/solutions/products/product-catalog/view/healthcare-aide-7-0-solution/,Pre-packaged Job Solutions,No,No,B,"Our Healthcare Aide 7.0 solution is designed for individually-oriented, entry-level positions that directly support another person's health and well-being. The solution covers a wide variety of positions, and assesses behaviors critical for patient support roles including: understanding and following detailed instructions; administering personal care; being respectful and tolerant of patients; preparing and maintaining records of patient progress and services performed; and working hard to meet or exceed patient needs.  
Potential job titles that use this solution include: Personal Care Aide, Healthcare Aide, Home Health Aide, Dental Assistant.
Report Language Availability: English (USA), Latin American Spanish.","Entry-Level,",Approximate Completion Time in minutes = 22
Healthcare Call Center Agent Solution,https://www.shl.com/solutions/products/product-catalog/view/healthcare-call-center-agent-solution/,Pre-packaged Job Solutions,No,Yes,"A, B, P, S","The Healthcare Call Center Agent solution is for entry-level positions in an inbound healthcare call center environment.  Sample tasks for this job include, but are not limited to: taking and receiving information from patients over the phone, working between computer screens, and entering information into a computer.  Potential job titles that use this solution are: Call Center Representative, Receptionist, and Switchboard Operator.  Multiple configurations of this solution are available.","Entry-Level,",Approximate Completion Time in minutes = 44
Healthcare Service Associate Solution,https://www.shl.com/solutions/products/product-catalog/view/healthcare-service-associate-solution/,Pre-packaged Job Solutions,No,Yes,"A, B, P","The Healthcare Service Associate solution is for entry-level positions in a healthcare environment that require the employee to interact with patients.  Sample tasks for this job include, but are not limited to: delivering food to patients, cleaning patient rooms, and welcoming guests to the hospital.  Potential job titles that use this solution are: Housekeepers, Dietary Aides, and Guest Services Coordinator. There are multiple configurations and versions of this solution available.","Entry-Level,",Approximate Completion Time in minutes = 37
Healthcare Support Specialist Solution,https://www.shl.com/solutions/products/product-catalog/view/healthcare-support-specialist-solution/,Pre-packaged Job Solutions,No,Yes,"A, B, P","The Healthcare Support Specialist solution is for entry-level positions in a healthcare environment that do not require the employee to interact with patients.  Sample tasks for this job include, but are not limited to: preparing food for patients, washing hospital linens, and cleaning the healthcare facility.  Potential job titles that use this solution are: Janitors, Food Preparation Workers, and Laundry Associates.  Multiple configurations of this solution are available.","Entry-Level,",Approximate Completion Time in minutes = 30
Home Health Aide Solution,https://www.shl.com/solutions/products/product-catalog/view/home-health-aide-solution/,Pre-packaged Job Solutions,No,Yes,"A, B, P","The Home Health Aide solution is for entry-level positions in an in-home or group home environment.  Sample tasks for this job include, but are not limited to: monitoring vital signs and medication intake, administering bedside and personal care such as ambulation and personal hygiene, and preparing and maintaining records of patient progress and services performed.  Potential job titles that use this solution are: Personal Care Aide, Home Health Aide, Residential Assistant, and Certified Nursing Assistant. There are multiple configurations and versions of this solution available.","Entry-Level,",Approximate Completion Time in minutes = 41
Hospitality Manager Solution,https://www.shl.com/solutions/products/product-catalog/view/hospitality-manager-solution/,Pre-packaged Job Solutions,No,Yes,"A, B, K, P","The Hospitality Manager solution is designed for management level positions in the hospitality industry. Sample tasks include overall property management, managing staff and managing the guest experience. The solution is focused on managing business operations, managing staff, solving problems, making good decisions and maintaining focus on the customer. Potential job titles that use this solution are: Property Manager, Property Director, Hotel Manager and Hospitality Manager. Multiple configurations of this solution are available.","Front Line Manager, Manager, Supervisor,",Approximate Completion Time in minutes = 57
Host Solution,https://www.shl.com/solutions/products/product-catalog/view/host-solution/,Pre-packaged Job Solutions,No,Yes,"B, P","The Host solution is designed for entry level positions in the hospitality industry. Sample tasks include greeting guests, managing wait lists and showing guests to their tables. The solution is focused on work ethic and customer focus. Potential job titles that use this solution are: Host, Hostess and Greeter. There are multiple configurations and versions of this solution available.","Entry-Level,",Approximate Completion Time in minutes = 30
Industrial - Entry Level 7.0 Solution,https://www.shl.com/solutions/products/product-catalog/view/industrial-entry-level-7-0-solution/,Pre-packaged Job Solutions,No,No,B,"Our Industrial – Entry Level 7.0 solution is designed for entry-level positions, and measures the behaviors and experiences that underlie successful and safe performance in general or light industrial roles. The solution covers a wide variety of entry-level positions, and assesses behaviors including: following policies and procedures; general facility upkeep; producing high quality work; maintaining an orderly work environment; wearing required protective equipment; and being thorough.
Potential job titles that use this solution include: Laborer, Custodians, Building and Grounds Maintenance Workers, Handyman.
Report Language Availability: English (USA), Latin American Spanish.","Entry-Level,",Approximate Completion Time in minutes = 20
Industrial - Entry Level 7.1 (Americas),https://www.shl.com/solutions/products/product-catalog/view/industrial-entry-level-7-1-%28americas%29/,Pre-packaged Job Solutions,No,No,B,"Our Industrial – Entry Level 7.1 solution is designed for entry-level positions, and measures the behaviors and experiences that underlie successful and safe performance in general or light industrial roles. The solution covers a wide variety of entry-level positions, and assesses behaviors including: following policies and procedures; general facility upkeep; producing high quality work; maintaining an orderly work environment; wearing required protective equipment; and being thorough.
Potential job titles that use this solution include: Laborer, Custodians, Building and Grounds Maintenance Workers, Handyman.
“IMPORTANT! Please note that you will need to select the correct package depending on which norm you intend to use. The package available for this product is International and Americas"".","Entry-Level,",Approximate Completion Time in minutes = 20
Industrial - Entry Level 7.1 (International),https://www.shl.com/solutions/products/product-catalog/view/industrial-entry-level-7-1-%28international%29/,Pre-packaged Job Solutions,No,No,B,"Our Industrial – Entry Level 7.1 solution is designed for entry-level positions, and measures the behaviors and experiences that underlie successful and safe performance in general or light industrial roles. The solution covers a wide variety of entry-level positions, and assesses behaviors including: following policies and procedures; general facility upkeep; producing high quality work; maintaining an orderly work environment; wearing required protective equipment; and being thorough.
Potential job titles that use this solution include: Laborer, Custodians, Building and Grounds Maintenance Workers, Handyman.
“IMPORTANT! Please note that you will need to select the correct package depending on which norm you intend to use. The package available for this product is International and Americas"".","Entry-Level,",Approximate Completion Time in minutes = 20
Industrial - Professional and Skilled 7.0 Solution,https://www.shl.com/solutions/products/product-catalog/view/industrial-professional-and-skilled-7-0-solution/,Pre-packaged Job Solutions,No,Yes,"A, B","Our Industrial – Professional and Skilled 7.0 solution is designed to measure the behaviors and experiences that underlie successful and safe performance in the workplace for specialized technical or professional industrial roles. 
This solution assesses mechanical comprehension and other foundational behaviors including: behaving safely and efficiently in the workplace; installing, repairing, and/or maintaining equipment and machinery; making sound mechanical decisions; maintaining an orderly work environment; and producing high quality and reliable work.
Report Language Availability: English (USA), Latin American Spanish.","Entry-Level,",Approximate Completion Time in minutes = 49
Industrial - Semi-skilled 7.1 (Americas),https://www.shl.com/solutions/products/product-catalog/view/industrial-semi-skilled-7-1-%28americas%29/,Pre-packaged Job Solutions,No,No,B,"Our Industrial – Semi-skilled 7.1 solution is designed for entry-level positions and measures the behaviors and experiences that underlie successful and safe performance for production workers. The solution assesses behaviors and competencies foundational to industrial roles including: following policies and procedures; applying relevant trade skills; wearing required protective equipment; working with or monitoring equipment; producing high quality work; effectively working with others; and maintaining an orderly work environment. 
Potential job titles that use this solution include: Production and Assembly Worker, Construction Worker, Extraction Technician.Please note this package is in Americas norm.","Entry-Level,",Approximate Completion Time in minutes = 24
Industrial - Semi-skilled 7.1 (International),https://www.shl.com/solutions/products/product-catalog/view/industrial-semi-skilled-7-1-%28international%29/,Pre-packaged Job Solutions,No,No,B,"Our Industrial – Semi-skilled 7.1 solution is designed for entry-level positions and measures the behaviors and experiences that underlie successful and safe performance for production workers. The solution assesses behaviors and competencies foundational to industrial roles including: following policies and procedures; applying relevant trade skills; wearing required protective equipment; working with or monitoring equipment; producing high quality work; effectively working with others; and maintaining an orderly work environment. 
Potential job titles that use this solution include: Production and Assembly Worker, Construction Worker, Extraction Technician.Please note this package is in International norm.","Entry-Level,",Approximate Completion Time in minutes = 24
Industrial Professional and Skilled 7.1 (Americas),https://www.shl.com/solutions/products/product-catalog/view/industrial-professional-and-skilled-7-1-%28americas%29/,Pre-packaged Job Solutions,No,No,"A, B","Our Industrial – Professional and Skilled 7.1 solution is designed to measure the behaviors and experiences that underlie successful and safe performance in the workplace for specialized technical or professional industrial roles. 
This solution assesses mechanical comprehension and other foundational behaviors including: behaving safely and efficiently in the workplace; installing, repairing, and/or maintaining equipment and machinery; making sound mechanical decisions; maintaining an orderly work environment; and producing high quality and reliable work.“IMPORTANT! Please note that you will need to select the correct package depending on which norm you intend to use. The package available for this product is International and Americas"".","Entry-Level,",Approximate Completion Time in minutes = 49
Industrial Professional and Skilled 7.1 Solution,https://www.shl.com/solutions/products/product-catalog/view/industrial-professional-and-skilled-7-1-solution/,Pre-packaged Job Solutions,No,No,"A, B","Our Industrial – Professional and Skilled 7.1 solution is designed to measure the behaviors and experiences that underlie successful and safe performance in the workplace for specialized technical or professional industrial roles. 
This solution assesses mechanical comprehension and other foundational behaviors including: behaving safely and efficiently in the workplace; installing, repairing, and/or maintaining equipment and machinery; making sound mechanical decisions; maintaining an orderly work environment; and producing high quality and reliable work.“IMPORTANT! Please note that you will need to select the correct package depending on which norm you intend to use. The package available for this product is International and Americas"".","Entry-Level,",Approximate Completion Time in minutes = 49
Installation and Repair Technician Solution,https://www.shl.com/solutions/products/product-catalog/view/installation-and-repair-technician-solution/,Pre-packaged Job Solutions,No,Yes,"A, B, P, S","The Installation and Repair Technician solution is designed for use with entry-level field technician positions in the telecommunications industry. The solution is focused on positions that involve installing, repairing, and maintaining telecommunications equipment, along with some customer interaction, and little to no specific sales components. Sample tasks may include: installing or repairing end-user telecommunications equipment and services, interacting with customers, and installing, or repairing telecommunications network infrastructure. Potential job titles that use this solution are: Installer, Service Technician, and Customer Installation Technician. There are multiple configurations of this solution available.","Professional Individual Contributor,",Approximate Completion Time in minutes = 49
