Assessment Name,URL,Category,Remote Testing,Adaptive/IRT,Test Type,Description,Job Level,Assessment Length
Professional/Individual Contributor - Short Form,https://www.shl.com/solutions/products/product-catalog/view/professionalindividual-contributor-short-form/,Pre-packaged Job Solutions,No,Yes,"A, B, P, S","The Professional/Individual Contributor solution is for mid to upper-level, non-managerial positions. Sample tasks for these jobs include, but are not limited to: meeting with clients to determine their needs, analyzing data sets, and working with co-workers to complete projects. Potential job titles that use this solution are: Engineer, Human Resource Consultant, and IT Analyst.","Mid-Professional, Professional Individual Contributor,",Approximate Completion Time in minutes = 44
Project Manager - Short Form,https://www.shl.com/solutions/products/product-catalog/view/project-manager-short-form/,Pre-packaged Job Solutions,No,Yes,"A, B, P, S","The Project Manager solution is designed for positions that lead medium to large scale projects with multiple team members involved. Sample tasks for this job include, but are not limited to: guiding, supervising, and influencing project team members, scoping project resource requirements, and managing project timelines, scope and budgets. Potential job titles that ues this solution are: Project Manager, Implementation Manager, Construction Project Manager and IT Project Manager.","Professional Individual Contributor,",Approximate Completion Time in minutes = 49
Proof Operator - Processing Specialist -Short Form,https://www.shl.com/solutions/products/product-catalog/view/proof-operator-processing-specialist-short-form/,Pre-packaged Job Solutions,No,No,S,"The Proof Operator – Processing Specialist solution is for entry-level positions that perform basic daily bank operations procedures such as the processing of deposits, reconciling accounts, and handling money transfers.  Potential job titles include:  Proof Operator, Bank Operations Processor, and Operations Specialist.","Entry-Level,",Approximate Completion Time in minutes = 30
Reservation Agent Solution,https://www.shl.com/solutions/products/product-catalog/view/reservation-agent-solution/,Pre-packaged Job Solutions,No,Yes,"A, P, S, B","The Reservation Agent solution is designed for entry-level positions within the hospitality industry. Sample tasks may indlude making, updating, or canceling reservations; looking up information and entering information into a computer; providing information on the hotel and the services offered. Potential titles that use this solution are: Reservation Agent, Customer Service Representative and Reservationist. Multiple configurations of this solution are available.","Entry-Level,",Approximate Completion Time in minutes = 43
Restaurant Manager Solution,https://www.shl.com/solutions/products/product-catalog/view/restaurant-manager-solution/,Pre-packaged Job Solutions,No,Yes,"A, B, P, S","The Restaurant Manager solution is designed for management level positions in the hospitality industry. Sample tasks include purchasing food and supplies, accounting, setting policies and procedures, and managing staff. The solution is focused on managing staff, solving problems, making good decisions and maintaining focus on the customer. Potential job titles that use this solution are: Restaurant Manager and General Manager. Multiple configurations of this solution are available.","Front Line Manager, Manager, Supervisor,",Approximate Completion Time in minutes = 48
Restaurant Supervisor Solution,https://www.shl.com/solutions/products/product-catalog/view/restaurant-supervisor-solution/,Pre-packaged Job Solutions,No,Yes,"A, B, P","The Restaurant Supervisor solution is designed for management level positions in the hospitality industry. Sample tasks include serving as a staff resource, setting schedules and monitoring daily operations. The solution is focused on solving problems, making good decisions and maintaining focus on the customer. Potential job titles that use this solution are: Restaurant Supervisor and Restaurant Staff Supervisor. Multiple configurations of this solution are available.","Front Line Manager, Manager, Supervisor,",Approximate Completion Time in minutes = 53
Retail Consultant Solution,https://www.shl.com/solutions/products/product-catalog/view/retail-consultant-solution/,Pre-packaged Job Solutions,No,Yes,"A, B, P","The Retail Consultant solution is for entry to mid-level retail positions in which employees proactively sell products to customers, develop relationships with repeat customers, and have their pay and/or performance heavily based on sales revenue.  Sample tasks for these jobs include, but are not limited to: promoting products to customers, persuading customers to buy products, and building ongoing customer relationships.  Potential job titles that use this solution are: Sales Consultant, Sales Representative, and Retail Sales Associate. There are multiple configurations and versions of this solution available.","Entry-Level,",Approximate Completion Time in minutes = 45
Retail Manager w/ Sales Solution,https://www.shl.com/solutions/products/product-catalog/view/retail-manager-w-sales-solution/,Pre-packaged Job Solutions,No,Yes,"A, B, P","The Retail Manager with Sales solution is an assessment used for job candidates applying to entry-level leadership positions who tend to supervise hourly employees but also have a significant portion of their job performance based on sales and customer service. Sample tasks for these jobs include, but are not limited to:  planning and preparing work schedules, assigning employees to specific duties; promoting products to customers; training subordinates; building ongoing customer relationships; and making day-to-day decisions with minimal guidance from others. Potential job titles that use this solution are: Assistant Manager, Sales Supervisor, Retail Manager, and Floor Leader. There are multiple configurations and versions of this solution available.","Front Line Manager, Manager, Supervisor,",Approximate Completion Time in minutes = 43
Retail Sales Associate Solution,https://www.shl.com/solutions/products/product-catalog/view/retail-sales-associate-solution/,Pre-packaged Job Solutions,No,Yes,"A, B, P","The Retail Sales Associate solution is for entry-level retail positions in which employees proactively sell products to customers and have their pay and/or performance based on sales revenue.  Sample tasks for these jobs include, but are not limited to: promoting products to customers, persuading customers to buy products, and completing a transaction with a customer.  Potential job titles that use this solution are: Sales Representative, Retail Sales Associate, and Sales Clerk. There are multiple configurations and versions of this solution available.","Entry-Level,",Approximate Completion Time in minutes = 29
Sales Director Solution,https://www.shl.com/solutions/products/product-catalog/view/sales-director-solution/,Pre-packaged Job Solutions,No,Yes,"A, B, P","The Sales Director solution is for mid- to senior-level sales management positions that oversee the sales function across multiple offices or geographic territories.  Sample tasks for these jobs include, but are not limited to: directing a group of sales supervisors or sales managers, having profit and loss responsibility for a district or region, and aligning work with overall company goals.  Potential job titles that use this solution are: Regional Sales Director, District Sales Manager, and Sales Director.  Multiple configurations of this solution are available.","Director, Front Line Manager, Manager,",Approximate Completion Time in minutes = 59
Sales Engineer Solution,https://www.shl.com/solutions/products/product-catalog/view/sales-engineer-solution/,Pre-packaged Job Solutions,No,Yes,"A, B, K, P, S","The Sales Engineer solution is designed for use with professional level telecommunications engineers with distinct sales responsibilities. The solution is focused on positions that involve the design of telecommunications networks for specific customer applications, and places an emphasis on reasoning ability and sales ability. Sample tasks may include: designing network solutions to meet customer needs, communicating technical information to all levels of clients participating in the sales process, assisting or owning the sales process, and ensuring proper implementation of contracted equipment and services. Potential job titles that use this solution are: Sales Engineer, Senior Technical Consultant, and Technical Sales Lead. There are multiple configurations of this solution available.","Professional Individual Contributor,",Approximate Completion Time in minutes = 61
Sales Manager Solution,https://www.shl.com/solutions/products/product-catalog/view/sales-manager-solution/,Pre-packaged Job Solutions,No,Yes,"A, B, P","The Sales Manager solution is an assessment used for applying to entry to mid-level sales leadership positions that generally manage employees and have a significant portion of their job performance based on sales. Sample tasks for these jobs include, but are not limited to: planning and preparing sales plans, promoting products to customers, training subordinates, building ongoing customer
relationships, and making day-to-day decisions with minimal guidance from others. Potential job titles that use this solution are: Sales Manager and Manager of Direct Sales.","Front Line Manager, Manager,",Approximate Completion Time in minutes = 63
Sales Professional 7.0 Solution,https://www.shl.com/solutions/products/product-catalog/view/sales-professional-7-0-solution/,Pre-packaged Job Solutions,No,No,"C, B","Our Sales Professional 7.0 solution is designed for entry to mid-level sales positions in which employees proactively sell products to customers, develop relationships with repeat customers, and have their pay and/or performance heavily based on sales revenue. Sample tasks for these jobs include, but are not limited to: promoting products to customers, persuading customers to buy products, and building ongoing customer relationships.
Report Language Availability: English (USA).","Mid-Professional, Professional Individual Contributor,",Approximate Completion Time in minutes = 21
Sales Professional 7.1 (Americas),https://www.shl.com/solutions/products/product-catalog/view/sales-professional-7-1-%28americas%29/,Pre-packaged Job Solutions,No,No,"B, C","Our Sales Professional 7.1 solution is designed for entry to mid-level sales positions in which employees proactively sell products to customers, develop relationships with repeat customers, and have their pay and/or performance heavily based on sales revenue. Sample tasks for these jobs include, but are not limited to: promoting products to customers, persuading customers to buy products, and building ongoing customer relationships.","Professional Individual Contributor, Mid-Professional,",Approximate Completion Time in minutes = 21
Sales Professional Solution,https://www.shl.com/solutions/products/product-catalog/view/sales-professional-solution/,Pre-packaged Job Solutions,No,Yes,"A, B, P","The Sales Professional solution is for entry to mid-level sales positions in which employees proactively sell products to customers, develop relationships with repeat customers, and have their pay and/or performance heavily based on sales revenue. Sample tasks for these jobs include, but are not limited to: promoting products to customers, persuading customers to buy products, and building ongoing customer relationships.
Potential job titles that use this solution are: Sales Consultant, Sales Representative, and Account Representative. Multiple configurations of this solution are available.","Mid-Professional,",Approximate Completion Time in minutes = 47
Sales Representative Solution,https://www.shl.com/solutions/products/product-catalog/view/sales-representative-solution/,Pre-packaged Job Solutions,No,Yes,"A, B, P","The Sales Representative solution is for entry-level sales positions in which employees proactively sell products to customers and have their pay and/or performance based on sales revenue. Sample tasks for these jobs include, but are not limited to: promoting products to customers, persuading customers to buy products, and completing a transaction with a customer. Potential job titles that use this solution are: Sales
Representative, Sales Associate, and Sales Clerk. Multiple configurations of this solution are available.","Entry-Level,",Approximate Completion Time in minutes = 29
Sales Supervisor Solution,https://www.shl.com/solutions/products/product-catalog/view/sales-supervisor-solution/,Pre-packaged Job Solutions,No,Yes,"A, B, P","The Sales Supervisor solution is an assessment used for job candidates applying to entry-level sales leadership positions that generally supervise employees and have a significant portion of their job performance based on sales. Sample tasks for these jobs include, but are not limited to: planning and preparing work schedules, promoting products to customers; training subordinates; building ongoing customer relationships;
and making day-to-day decisions with minimal guidance from others. Potential job titles that use this solution are: Assistant Sales Manager and Sales Supervisor. Multiple configurations of this solution are available.","Front Line Manager, Manager, Supervisor,",Approximate Completion Time in minutes = 38
Sales Support Specialist Solution,https://www.shl.com/solutions/products/product-catalog/view/sales-support-specialist-solution/,Pre-packaged Job Solutions,No,Yes,"A, B, P","The Sales Support Specialist solution is for entry to mid-level sales support positions in which employees work primarily under the guidance of an account manager or operations manager in support of client accounts. Sample tasks for these jobs include, but are not limited to: implementing customer orders, assisting with and coordinating activities, and utilizing processes to meet customer requirements. Potential job titles that use
this solution are: Implementation Specialist, Project Assistant, and Sales Support Assistant. Multiple configurations of this solution are available.","Entry-Level,",Approximate Completion Time in minutes = 43
Senior Insurance Agent Solution,https://www.shl.com/solutions/products/product-catalog/view/senior-insurance-agent-solution/,Pre-packaged Job Solutions,No,No,"A, B, P","The Senior Insurance Agent solution is for senior-level professional positions in the insurance industry that sell a portfolio of insurance products, including property, casualty, automotive, health, and life. Sample tasks for this position include, but are not limited to: calling on policyholders to deliver and explain policies or suggest additions or changes; calculating premiums; customizing insurance programs to suit individual customers; ensuring policy requirements are fulfilled; and conferring with clients to obtain and provide information when claims are made on a policy. Potential job titles that use this solution are: Insurance Senior Sales Professional, Senior Producer, Insurance Sales Agent, and Insurance Agent. Multiple configurations of this solution are available.","Professional Individual Contributor,",Approximate Completion Time in minutes = 44
Senior Sales Professional Solution,https://www.shl.com/solutions/products/product-catalog/view/senior-sales-professional-solution/,Pre-packaged Job Solutions,No,Yes,"A, B, P","The Senior Sales Professional solution is for high-level sales positions in which employees proactively sell products to customers, develop relationships with new or existing customers, and have their pay and/or performance heavily based on sales revenue. Sample tasks for these jobs include, but are not limited to: promoting products to customers, consulting with and persuading customers to buy products, and building
ongoing customer relationships. Potential job titles that use this solution are: Senior Sales Representative, Business Development Manager, and Senior Sales Consultant. Multiple configurations of this solution are available.","Professional Individual Contributor,",Approximate Completion Time in minutes = 42
Server Solution,https://www.shl.com/solutions/products/product-catalog/view/server-solution/,Pre-packaged Job Solutions,No,Yes,"B, A, P","The Server solution is designed for entry-level positions in the hospitality industry. Sample tasks include greeting customers, taking customer food and drink orders and delivering food items to guests. The solution is focused on work ethic, customer focus and sales. Potential job titles that use this solution are: Server and Waiter/Waitress. Multiple configurations of this solution are available.","Entry-Level,",Approximate Completion Time in minutes = 40
Service Associate Solution,https://www.shl.com/solutions/products/product-catalog/view/service-associate-solution/,Pre-packaged Job Solutions,No,Yes,"A, B, P","The Service Associate is designed for entry-level positions that are primarily task focused but may include a customer service component. The solution covers a wide variety of support positions in the hospitality industry and sample tasks may include: cleaning hotel rooms, serving food at buffet lines, parking cars, and/or delivering food to hotel rooms. Potential job titles that use this solution are: Housekeeper, Buffet Server, Room Service Attendant, and Valet. Multiple configurations of this solution are available.","Entry-Level,",Approximate Completion Time in minutes = 38
Service Supervisor Solution,https://www.shl.com/solutions/products/product-catalog/view/service-supervisor-solution/,Pre-packaged Job Solutions,No,Yes,"A, B, P","The Service Supervisor solution is designed for entry-level leadership positions in the hospitality industry that oversee hourly and salaried employees in customer facing positions (e.g. Front Desk Associate, Concierge, Guest Service Associate). Individuals in these roles perform many of hte duties of the employees they supervise. Sample tasks may include: assisting challenging guests, coaching employees on their customer service skills, taking corrective action when an employee is performing poorly, and monitoring employees to assess the satisfactory completion of tasks. Potential job titles that use this solution are: Front Desk Manager, Guest Services Supervisor, and Front Desk Supervisor. Multiple configurations of this solution are available.","Front Line Manager, Manager, Supervisor,",Approximate Completion Time in minutes = 48
Stock Clerk Solution,https://www.shl.com/solutions/products/product-catalog/view/stock-clerk-solution/,Pre-packaged Job Solutions,No,No,"A, B, P","The Stock Clerk solution is for entry-level retail positions in which employees work primarily in the stockroom handling incoming and outgoing shipment and keeping the sales floor fully stocked.  Sample tasks for these jobs include, but are not limited to: unload product shipment, maintain stockroom organization, replenish supplies and products on the sales floor, and process outgoing shipments.  Potential job titles that use this solution are: Stock Clerk, Inventory Associate, and Warehouse Associate. Multiple configurations of this solution are available.","Entry-Level,",Approximate Completion Time in minutes = 25
Store Manager 7.0 Solution,https://www.shl.com/solutions/products/product-catalog/view/store-manager-7-0-solution/,Pre-packaged Job Solutions,No,No,"B, C","Our Store Manager 7.0 solution is designed for candidates applying to entry-level leadership positions who tend to supervise hourly employees in a retail or restaurant setting. Sample tasks for these jobs include, but are not limited to: planning and preparing work schedules, assigning employees to specific duties; coaching employees on attendance, conduct, schedule adherence, and work tasks, developing employees' skills; training subordinates; prioritizing multiple tasks and priorities; and making day-to-day decisions with minimal guidance from others.
Report Language Availability: English (USA), Latin American Spanish.","Front Line Manager, Manager,",Approximate Completion Time in minutes = 34
Store Manager 7.1 (Americas),https://www.shl.com/solutions/products/product-catalog/view/store-manager-7-1-%28americas%29/,Pre-packaged Job Solutions,No,No,"B, C","Our Store Manager 7.1 solution is designed for candidates applying to entry-level leadership positions who tend to supervise hourly employees in a retail or restaurant setting. Sample tasks for these jobs include, but are not limited to: planning and preparing work schedules, assigning employees to specific duties; coaching employees on attendance, conduct, schedule adherence, and work tasks, developing employees' skills; training subordinates; prioritizing multiple tasks and priorities; and making day-to-day decisions with minimal guidance from others.","Front Line Manager, Manager,",Approximate Completion Time in minutes = 34
Store Manager 7.1 (International),https://www.shl.com/solutions/products/product-catalog/view/store-manager-7-1-%28international%29/,Pre-packaged Job Solutions,No,No,"C, B","Our Store Manager 7.1 solution is designed for candidates applying to entry-level leadership positions who tend to supervise hourly employees in a retail or restaurant setting. Sample tasks for these jobs include, but are not limited to: planning and preparing work schedules, assigning employees to specific duties; coaching employees on attendance, conduct, schedule adherence, and work tasks, developing employees' skills; training subordinates; prioritizing multiple tasks and priorities; and making day-to-day decisions with minimal guidance from others.","Front Line Manager, Manager,",Approximate Completion Time in minutes = 34
Store Manager Solution,https://www.shl.com/solutions/products/product-catalog/view/store-manager-solution/,Pre-packaged Job Solutions,No,Yes,"A, B, P","The Store Manager solution is an assessment used for job candidates applying to entry-level leadership positions who tend to supervise hourly employees. Sample tasks for these jobs include, but are not limited to:  planning and preparing work schedules, assigning employees to specific duties; coaching  employees on attendance, conduct, schedule adherence, and work tasks, developing employees' skills ; training subordinates; prioritizing multiple tasks  and priorities; and making  day-to-day decisions with minimal guidance from others. Potential job titles that use this solution are: Store Manager, First Line Supervisor, Retail Manager, Restaurant Manager, and Customer Service Supervisor. Multiple configuration options of this solution are available.","Manager, Supervisor,",Approximate Completion Time in minutes = 49
Supervisor - Short Form,https://www.shl.com/solutions/products/product-catalog/view/supervisor-short-form/,Pre-packaged Job Solutions,No,Yes,S,"The Supervisor solution is an assessment used for job candidates applying to entry-level leadership positions who tend to supervise hourly employees. Sample tasks for these jobs include, but are not limited to:  planning and preparing work schedules, assigning employees to specific duties; coaching  employees on attendance, conduct, schedule adherence, and work tasks, developing employees' skills ; training subordinates; prioritizing multiple tasks  and priorities; and making  day-to-day decisions with minimal guidance from others. Potential job titles that use this solution are: Team Leader, First Line Supervisor, Call Center Supervisor, and Customer Service Supervisor.","Front Line Manager, Manager, Supervisor,",Approximate Completion Time in minutes = 57
Supervisor 7.0 Solution,https://www.shl.com/solutions/products/product-catalog/view/supervisor-7-0-solution/,Pre-packaged Job Solutions,No,No,"B, C","Our Supervisor 7.0 solution is designed for candidates applying to entry-level leadership positions who tend to supervise hourly employees. Sample tasks for these jobs include, but are not limited to: planning and preparing work schedules, assigning employees to specific duties; coaching employees on attendance, conduct, schedule adherence, and work tasks, developing employees' skills; training subordinates; prioritizing multiple tasks and priorities; and making day-to-day decisions with minimal guidance from others.
Report Language Availability: English (USA), Latin American Spanish.","Supervisor,",Approximate Completion Time in minutes = 32
Supervisor 7.1 (Americas),https://www.shl.com/solutions/products/product-catalog/view/supervisor-7-1-%28americas%29/,Pre-packaged Job Solutions,No,No,"B, C, P","Our Supervisor 7.1 solution is designed for candidates applying to entry-level leadership positions who tend to supervise hourly employees. Sample tasks for these jobs include, but are not limited to: planning and preparing work schedules, assigning employees to specific duties; coaching employees on attendance, conduct, schedule adherence, and work tasks, developing employees' skills; training subordinates; prioritizing multiple tasks and priorities; and making day-to-day decisions with minimal guidance from others.
Report Language Availability: English (USA), Canadian French, Brazilian Portuguese.
 “IMPORTANT! Please note that you will need to select the correct package depending on which norm you intend to use. The package available for this product is International and Americas"".","Front Line Manager, Supervisor,",Approximate Completion Time in minutes = 29
