Assessment Name,URL,Category,Remote Testing,Adaptive/IRT,Test Type,Description,Job Level,Assessment Length
Insurance Account Manager Solution,https://www.shl.com/solutions/products/product-catalog/view/insurance-account-manager-solution/,Pre-packaged Job Solutions,No,Yes,"A, B, P, S","The Insurance Account Manager solution is for mid-level insurance professionals that manage the day-to-day operations and activities of customer accounts.  Sample tasks for this job include, but are not limited to: soliciting sales of new or additional products or services; interacting with customers to provide information in response to inquiries about products and services and to handle and resolve complaints; keeping records of customer interactions and transactions; resolving customers' service or billing complaints; determining charges for services requested; collecting deposits or payments; and arranging for billing.  Potential job titles that use this solution are: Account Executive, Account Manager, and Senior Account Manager.  Multiple configurations of this solution are available.","Mid-Professional,",Approximate Completion Time in minutes = 48
Insurance Administrative Assistant Solution,https://www.shl.com/solutions/products/product-catalog/view/insurance-administrative-assistant-solution/,Pre-packaged Job Solutions,No,Yes,"A, B, P, S","The Administrative Assistant solution is for entry-level clerical positions that interact with external or internal customers. Sample tasks for this job include, but are not limited to: answering telephones; managing files and records; sorting mail; handling information requests; greeting customers; and collaborating with co-workers on projects. Potential job titles that use this solution are: Receptionist and Administrative Assistant. Multiple configurations of this solution are available.","Entry-Level,",Approximate Completion Time in minutes = 24
Insurance Agent Solution,https://www.shl.com/solutions/products/product-catalog/view/insurance-agent-solution/,Pre-packaged Job Solutions,No,Yes,"A, B, P","The Insurance Agent solution is for mid-level professional positions in the insurance industry that sell property, casualty, automotive, or other types of insurance. Sample tasks for this position include, but are not limited to: calling on policyholders to deliver and explain policies or suggest additions or changes; calculating premiums; customizing insurance programs to suit individual customers; ensuring policy requirements are fulfilled; and conferring with clients to obtain and provide information when claims are made on a policy. Potential job titles that use this solution are: Insurance Sales Professional; Insurance Sales Agent; Producer; Insurance Agent. Multiple configurations of this solution are available.","Mid-Professional,",Approximate Completion Time in minutes = 46
Insurance Director Solution,https://www.shl.com/solutions/products/product-catalog/view/insurance-director-solution/,Pre-packaged Job Solutions,No,Yes,"A, B, P","The Insurance Director solution is for senior-level management positions in the insurance companies that oversee sales functions across multiple brokerages, offices, or agencies or geographic territories. Sample tasks for this job includes, but is not limited to: directing a group of sales managers or agency managers; having profit and loss responsibility for a district or region; and aligning work with overall company goals. Potential job titles that use this solution are: Regional Managers, Associate Directors, and Managing Directors. Multiple configurations of this solution are available.","Director, Front Line Manager, Manager, Supervisor,",Approximate Completion Time in minutes = 49
Insurance Sales Manager Solution,https://www.shl.com/solutions/products/product-catalog/view/insurance-sales-manager-solution/,Pre-packaged Job Solutions,No,Yes,"A, B, P, S","The Sales Manager solution is for entry- to mid-level management positions that involve supervising employees working in an insurance organization and have a substantial portion of their job performance based on sales. Sample tasks for this job include, but are not limited to: planning and preparing work schedules; promoting products to customers; training subordinates; analyzing sales statistics gathered by staff to determine sales potential and monitor preferences of customers; building ongoing customer relationships; and making day-to-day decisions with minimal guidance from others. Potential job titles that use this solution are: Insurance Sales Manager, Sales Manager, Assistant Sales Manager, and Sales Supervisor. Multiple configurations of this solution are available.","Front Line Manager, Manager, Supervisor,",Approximate Completion Time in minutes = 51
Manager - Short Form,https://www.shl.com/solutions/products/product-catalog/view/manager-short-form/,Pre-packaged Job Solutions,No,Yes,"A, B, K, P, S","The Manager solution is an assessment used for job candidates applying to entry-level leadership positions who tend to supervise salaried employees. Sample tasks for these jobs include, but are not limited to: planning projects with subordinates; collaborating with senior managers on developing new methods and procedures; coaching employees on performance-related issues; developing employees' skills; coordinating activities with other managers to accomplish organizational goals; setting and meeting department goals; prioritizing multiple tasks and priorities; making selected strategic and day-to-day decisions; and solving employees' and customers' problems. Potential job titles that use this solution are: Manager, Store Manager, and Branch Manager.","Front Line Manager, Manager, Supervisor,",Approximate Completion Time in minutes = 57
Manager + 7.0 Solution,https://www.shl.com/solutions/products/product-catalog/view/manager-7-0-solution-3955/,Pre-packaged Job Solutions,No,Yes,"A, B, C","Our Manager + 7.0 solution is designed for candidates applying to entry-level leadership positions who tend to supervise salaried employees, and includes SHL’s new innovative mobile-first ability assessment, Verify Interactive – Deductive Reasoning. Sample tasks for these jobs include, but are not limited to: planning projects with subordinates; collaborating with senior managers on developing new methods and procedures; coaching employees on performance-related issues; developing employees ' skills; coordinating activities with other managers to accomplish organizational goals; setting and meeting department goals; prioritizing multiple tasks and priorities; making selected strategic and day-to-day decisions; and solving employees' and customers' problems.
Report Language Availability: English (USA).","Front Line Manager, Manager,",Approximate Completion Time in minutes = 53
Manager + 7.1 (Americas),https://www.shl.com/solutions/products/product-catalog/view/manager-7-1-solution-4242/,Pre-packaged Job Solutions,No,Yes,"B, C, P","Our Manager + 7.1 solution is designed for candidates applying to entry-level leadership positions who tend to supervise salaried employees, and includes SHL’s new innovative mobile-first ability assessment, Verify Interactive – Deductive Reasoning. Sample tasks for these jobs include, but are not limited to: planning projects with subordinates; collaborating with senior managers on developing new methods and procedures; coaching employees on performance-related issues; developing employees ' skills; coordinating activities with other managers to accomplish organizational goals; setting and meeting department goals; prioritizing multiple tasks and priorities; making selected strategic and day-to-day decisions; and solving employees' and customers' problems.
Report Language Availability: English (USA), Canadian French. “IMPORTANT! Please note that you will need to select the correct package depending on which norm you intend to use. The package available for this product is Americas and International"".","Director, Executive, Front Line Manager, Manager,",Approximate Completion Time in minutes = 63
Manager + 7.1 (International),https://www.shl.com/solutions/products/product-catalog/view/manager-7-1-%28international%29/,Pre-packaged Job Solutions,No,Yes,"B, C, P","Our Manager + 7.1 solution is designed for candidates applying to entry-level leadership positions who tend to supervise salaried employees, and includes SHL’s new innovative mobile-first ability assessment, Verify Interactive – Deductive Reasoning. Sample tasks for these jobs include, but are not limited to: planning projects with subordinates; collaborating with senior managers on developing new methods and procedures; coaching employees on performance-related issues; developing employees ' skills; coordinating activities with other managers to accomplish organizational goals; setting and meeting department goals; prioritizing multiple tasks and priorities; making selected strategic and day-to-day decisions; and solving employees' and customers' problems.
Report Language Availability: English (USA), Canadian French, Brazilian Portuguese, Danish, Dutch, Finnish, Italian, Norwegian, Swedish. “IMPORTANT! Please note that you will need to select the correct package depending on which norm you intend to use. The package available for this product is Americas and International"".","Director, Executive, Front Line Manager, Manager,",Approximate Completion Time in minutes = 63
Manager 7.0 Solution,https://www.shl.com/solutions/products/product-catalog/view/manager-7-0-solution/,Pre-packaged Job Solutions,No,No,"B, C","Our Manager 7.0 solution is designed for candidates applying to entry-level leadership positions who tend to supervise salaried employees. Sample tasks for these jobs include, but are not limited to: planning projects with subordinates; collaborating with senior managers on developing new methods and procedures; coaching employees on performance-related issues; developing employees ' skills; coordinating activities with other managers to accomplish organizational goals; setting and meeting department goals; prioritizing multiple tasks and priorities; making selected strategic and day-to-day decisions; and solving employees' and customers' problems.
Report Language Availability: English (USA), Latin American Spanish.","Manager, Front Line Manager,",Approximate Completion Time in minutes = 35
Manager 7.1 (Americas),https://www.shl.com/solutions/products/product-catalog/view/manager-7-1-%28americas%29/,Pre-packaged Job Solutions,No,No,"B, C, P","Our Manager 7.1 solution is designed for candidates applying to entry-level leadership positions who tend to supervise salaried employees. Sample tasks for these jobs include, but are not limited to: planning projects with subordinates; collaborating with senior managers on developing new methods and procedures; coaching employees on performance-related issues; developing employees ' skills; coordinating activities with other managers to accomplish organizational goals; setting and meeting department goals; prioritizing multiple tasks and priorities; making selected strategic and day-to-day decisions; and solving employees' and customers' problems.Report Language Availability: English (USA), Danish, Finnish, Canadian French, Italian, Norwegian, French, German, English International,.  “IMPORTANT! Please note that you will need to select the correct package depending on which norm you intend to use. The package available for this product is International"".","Executive, Director, Front Line Manager, Manager,",Approximate Completion Time in minutes = 40
Manager 7.1 (International),https://www.shl.com/solutions/products/product-catalog/view/manager-7-1-solution/,Pre-packaged Job Solutions,No,No,"B, C, P","Our Manager 7.1 solution is designed for candidates applying to entry-level leadership positions who tend to supervise salaried employees. Sample tasks for these jobs include, but are not limited to: planning projects with subordinates; collaborating with senior managers on developing new methods and procedures; coaching employees on performance-related issues; developing employees ' skills; coordinating activities with other managers to accomplish organizational goals; setting and meeting department goals; prioritizing multiple tasks and priorities; making selected strategic and day-to-day decisions; and solving employees' and customers' problems.Report Language Availability: English (USA), Danish, Finnish, Canadian French, Italian, Norwegian, French, German, English International,.  “IMPORTANT! Please note that you will need to select the correct package depending on which norm you intend to use. The package available for this product is International"".","Director, Executive, Front Line Manager, Manager,",Approximate Completion Time in minutes = 40
Manager 8.0 JFA,https://www.shl.com/solutions/products/product-catalog/view/manager-8-0-jfa/,Pre-packaged Job Solutions,No,No,"B, K, P",The Manager 8.0 Job-Focused Assessment is designed for candidates applying to their first leadership positions. It measures behaviors that underlie successful performance in first-line manager roles across a wide range of industries. It is most relevant to positions that supervise salaried employees. This JFA includes the Reskilling Potential Scale and the Management Potential Scale. •The Reskilling Potential scale measures tendency to learn from experiences in a way that supports professional success. •The Management Potential scale measures the potential for managerial success across industry type and functional area.,"Manager,",Approximate Completion Time in minutes = 26
Manager 8.0+ JFA,https://www.shl.com/solutions/products/product-catalog/view/manager-8-0-jfa-4310/,Pre-packaged Job Solutions,No,No,"B, K, P","The Manager 8.0+ Job-Focused Assessment is designed for candidates applying to their first leadership positions and includes SHL’s new innovative mobile-first ability assessment, Verify Interactive – Inductive Reasoning. It measures behaviors that underlie successful performance in first-line manager roles across a wide range of industries. It is most relevant to positions that supervise salaried employees. This JFA includes the Reskilling Potential Scale and the Management Potential Scale. •The Reskilling Potential scale measures tendency to learn from experiences in a way that supports professional success. •The Management Potential scale measures the potential for managerial success across industry type and functional area.","Manager,",Approximate Completion Time in minutes = 44
Manufacturing Production Team Member,https://www.shl.com/solutions/products/product-catalog/view/manufacturing-production-team-member/,Pre-packaged Job Solutions,No,No,"A, B","The Manufacturing Production Team Member solution is designed for entry-level positions to measure the behaviors and experiences that underlie successful and safe performance in the workplace for production workers. This solution measures a candidate’s error checking abilities and general tendency to behave safely and efficiently in the workplace. The solution uses a variety of assessment types including measures of personality traits, safety-related situational judgment, and error checking. The Manufacturing Production Team Member solution is designed for selection to job titles, such as: Production Worker, Material Handler, Driver, Forklift Operator, Crewman, Mechanic, and Receiver.","Entry-Level,",Approximate Completion Time in minutes = 35
Manufacturing Skilled Maintenance Worker,https://www.shl.com/solutions/products/product-catalog/view/manufacturing-skilled-maintenance-worker/,Pre-packaged Job Solutions,No,No,"A, B","The Manufacturing Skilled Maintenance solution is designed for entry-level positions to measure the behaviors and experiences that underlie successful and safe performance in the workplace. This solution measures a candidate’s mechanical comprehension abilities and general tendency to behave safely and efficiently in the workplace. This solution uses a variety of assessment types including measures of personality traits, safety-related situational judgment, and mechanical comprehension. The Manufacturing Skilled Maintenance solution is designed for selection to job titles, such as: Industrial Machinery Mechanic, Automotive Service Technician, Small Engine Mechanic, Mobile Equipment Service Technician, and Diesel Service Technician.","Entry-Level,",Approximate Completion Time in minutes = 45
Network Engineer/Analyst Solution,https://www.shl.com/solutions/products/product-catalog/view/network-engineeranalyst-solution/,Pre-packaged Job Solutions,No,Yes,"P, S, K, B, A","The Network Engineer/Analyst solution is designed for use with professional level telecommunications engineers and network analysts. The solution is focused on positions that involve the design and monitoring of complex telecommunications networks, and places an emphasis on reasoning ability, attention to detail, and multitasking. Sample tasks may include: designing networks or network elements, ensuring proper network operation and performance, and monitoring and troubleshooting electronic data and communication networks. Potential job titles that use this solution are: Network Engineer, Network Analyst, and Communications Engineer. There are multiple configurations of this solution available.","Professional Individual Contributor,",Approximate Completion Time in minutes = 41
Nurse Leader Solution,https://www.shl.com/solutions/products/product-catalog/view/nurse-leader-solution/,Pre-packaged Job Solutions,No,Yes,"S, A, B, P","The Nurse Leader solution is an assessment used for job candidates applying to entry-level nurse leadership positions who tend to supervise hourly employees.  Sample tasks for these jobs include, but are not limited to: planning and preparing work schedules; assigning nurses to specific duties; coaching nurses on attendance, conduct, schedule adherence, and work related tasks; developing nurses' skills; training subordinates; prioritizing multiple tasks and priorities; and making day-to-day decisions with minimal guidance from others in a healthcare setting. Potential job titles that use this solution are: Nurse Leader or Nurse Manager. There are multiple configurations and versions of this solution available.","Front Line Manager, Manager, Supervisor,",Approximate Completion Time in minutes = 59
Nurse Solution,https://www.shl.com/solutions/products/product-catalog/view/nurse-solution/,Pre-packaged Job Solutions,No,Yes,"P, A, B","The Nurse solution is for professional-level healthcare nursing positions that require licensing or registration.  Sample tasks for these jobs include, but are not limited to: assessing the health conditions of patients, documenting patients' medical information, creating a nursing care plan, and educating patients' about healthcare issues.  Potential job titles that use this solution are: Registered Nurse, Charge Nurse, Licensed Practical Nurse, and Clinic Nurse.  Multiple configurations of this solution are available.","Professional Individual Contributor,",Approximate Completion Time in minutes = 66
Nursing Assistant Solution,https://www.shl.com/solutions/products/product-catalog/view/nursing-assistant-solution/,Pre-packaged Job Solutions,No,No,"A, B, P","The Nursing Assistant solution is for entry-level positions in a clinic or hospital environment. Sample tasks for this job include, but are not limited to: turning and re-positioning bedridden patients, feeding patients who cannot feed themselves, and observing patients' conditions, including measuring and recording food intake.  Potential job titles that use this solution are: Certified Nursing Assistant, Nursing Aide, Patient Care Technician, and Hospital Attendant.  Multiple configurations of this solution are available.","Entry-Level,",Approximate Completion Time in minutes = 41
Personal Banker - Short Form,https://www.shl.com/solutions/products/product-catalog/view/personal-banker-short-form/,Pre-packaged Job Solutions,No,No,"A, B, K, P, S","The Personal Banker – Loan Officer solution is for entry to mid-level financial institution positions. Sample tasks for this job would include, but are not limited to: acquiring, retaining and expanding new and existing customer relationships, discovering customer needs, making the best recommendation, completing sales, proactively contacting & meeting customers, and asking for referrals.","Entry-Level, Mid-Professional,",Approximate Completion Time in minutes = 30
Phone Banker - Short Form,https://www.shl.com/solutions/products/product-catalog/view/phone-banker-short-form/,Pre-packaged Job Solutions,No,No,"A, B, P","This solution is for entry to mid-level financial institution positions. Candidates are asked to answer multiple choice questions to assess learning potential, dependability, persistence and planfulness, sales focus, customer focus, and working with information.","Entry-Level, Mid-Professional,",Approximate Completion Time in minutes = 40
Prep/Line Cook Solution,https://www.shl.com/solutions/products/product-catalog/view/prepline-cook-solution/,Pre-packaged Job Solutions,No,Yes,"A, B, P","The Prep/Line Cook solution is for entry-level food preparation positions in the hospitality industry. Sample tasks include preparing ingredients and final food items for consumption. The solution is focused on work ethic and performing quality work with no direct customer contact or sales requirements. Potential job titles that use this solution are: Cook, Line Cook, Food Preparer, Prep Cook and Chef. Multiple configurations of this solution are available.","Entry-Level,",Approximate Completion Time in minutes = 24
Professional + 7.0 Solution,https://www.shl.com/solutions/products/product-catalog/view/professional-7-0-solution-3958/,Pre-packaged Job Solutions,No,Yes,"A, B, C","Our Professional + 7.0 solution is designed for all non-managerial professional individual contributor positions, and includes SHL’s new innovative mobile-first ability assessment, Verify Interactive – Deductive Reasoning. Sample tasks for these jobs include, but are not limited to: gathering requirements, analyzing data, managing projects, producing products or services.
Report Language Availability: English (USA).","Mid-Professional, Professional Individual Contributor,",Approximate Completion Time in minutes = 51
Professional + 7.1 (Americas),https://www.shl.com/solutions/products/product-catalog/view/professional-7-1-%28americas%29/,Pre-packaged Job Solutions,No,Yes,"B, C, P","Our Professional + 7.1 solution is designed for all non-managerial professional individual contributor positions, and includes SHL’s new innovative mobile-first ability assessment, Verify Interactive – Deductive Reasoning. Sample tasks for these jobs include, but are not limited to: gathering requirements, analyzing data, managing projects, producing products or services.","General Population, Mid-Professional, Professional Individual Contributor,",Approximate Completion Time in minutes = 56
Professional + 7.1 (International),https://www.shl.com/solutions/products/product-catalog/view/professional-7-1-solution/,Pre-packaged Job Solutions,No,Yes,"B, C, P","Our Professional + 7.1 solution is designed for all non-managerial professional individual contributor positions, and includes SHL’s new innovative mobile-first ability assessment, Verify Interactive – Deductive Reasoning. Sample tasks for these jobs include, but are not limited to: gathering requirements, analyzing data, managing projects, producing products or services.","General Population, Mid-Professional, Professional Individual Contributor,",Approximate Completion Time in minutes = 56
Professional 7.0 Solution,https://www.shl.com/solutions/products/product-catalog/view/professional-7-0-solution/,Pre-packaged Job Solutions,No,No,"B, C","Our Professional 7.0 solution is designed for all non-managerial professional individual contributor positions. Sample tasks for these jobs include, but are not limited to: gathering requirements, analyzing data, managing projects, producing products or services.
Report Language Availability: English (USA), Latin American Spanish.","Mid-Professional, Professional Individual Contributor,",Approximate Completion Time in minutes = 33
Professional 7.1 (International),https://www.shl.com/solutions/products/product-catalog/view/professional-7-1-solution-4247/,Pre-packaged Job Solutions,No,No,"C, B","Our Professional 7.1 solution is designed for all non-managerial professional individual contributor positions. Sample tasks for these jobs include, but are not limited to: gathering requirements, analyzing data, managing projects, producing products or services.","Professional Individual Contributor, Mid-Professional,",Approximate Completion Time in minutes = 33
Professional 8.0 JFA,https://www.shl.com/solutions/products/product-catalog/view/professional-8-0-jfa/,Pre-packaged Job Solutions,No,No,"B, K, P",The Professional 8.0 Job-Focused Assessment is designed for all non-managerial professional/individual contributor positions. It measures behaviors that underlie successful performance in a professional/individual contributor setting across a wide range of industries.,"Professional Individual Contributor,",Approximate Completion Time in minutes = 16
